基本工资,学历水平,依据,基本工资的确定主要依据市场供需量、岗位对公司效益产生的重要性、员工从业经验和学历水平
培训的内容,培训教师的专业水平,依据,培训的内容和进度主要是根据培训教师的专业水平和空闲时间而定。
培训的内容,空闲时间,依据,培训的内容和进度主要是根据培训教师的专业水平和空闲时间而定。
固定工资,岗位价值,依据,科研管理、职能和支撑人员的固定工资根据岗位价值确定。
固定工资,能力价值,依据,科研人员固定工资根据能力价值（职能）确定
固定工资的支付,能力价值,依据,是合理的；科研管理人员、职能和支撑人员固定工资的支付依据是能力价值（职称）
企业薪酬体系设计,企业的薪酬理念,依据,并据此确立企业的薪酬理念；薪酬理念是企业薪酬体系设计的依据
企业薪酬体系设计,薪酬理念,依据,并据此确立企业的薪酬理念；薪酬理念是企业薪酬体系设计的依据
企业的人力资源战略规划,企业的人力资源战略,依据,企业的人力资源战略规划应当根据企业的人力资源战略而定。
企业自主福利,员工的内在需求,依据,企业自主福利是企业根据自身的管理特色、财务状况和员工的内在需求
企业自主福利,管理特色,依据,企业自主福利是企业根据自身的管理特色、财务状况和员工的内在需求
人员分析,素质模型,依据,人员分析还可以根据素质模型来进行。
人力资源需求预测,能力水平,依据,人力资源需求预测就是根据能力水平和岗位要求确定所需员工的数量和类型。
人力资源需求预测,岗位要求,依据,人力资源需求预测就是根据能力水平和岗位要求确定所需员工的数量和类型。
人力资源结构规划,企业规模,依据,人力资源结构规划是依据行业特点、企业规模、未来战略重点发育的业务及业务模式
人力资源结构规划,行业特点,依据,人力资源结构规划是依据行业特点、企业规模、未来战略重点发育的业务及业务模式
人力资源管理,个人发展,依据,人力资源管理是根据组织和个人发展的需要
人力资源管理,发展战略,依据,这时的人力资源管理要根据发展战略的不同来提供不同的支持
人力资源数量规划,企业战略,依据,人力资源数量规划是依据企业战略对未来企业业务规模、地域分布、商业模式、业务流程和组织结构等因素
人力资源晋升规划,组织需要,依据,人力资源晋升规划是根据组织需要和人员分布状况制定员工的提升方案。
人力资源,组织战略,依据,人力资源获取是指根据组织战略和人力资源规划的要求
