定性方法,分类法,包含,定性方法包括职位分级法和分类法
定性方法,职位分级法,包含,定性方法包括职位分级法和分类法
定量方法,因素比较法,包含,而不考虑具体的职位特征；定量方法包括要素计点法和因素比较法
定量方法,要素计点法,包含,而不考虑具体的职位特征；定量方法包括要素计点法和因素比较法
导向评估法,目标管理法,包含,结果导向评估法主要包括：以个人绩效合约为基础的绩效考核、产量衡量法和目标管理法。
将测评要素,测评指标,包含,将测评要素层层分解成测评目标、测评项目、测评指标
将测评要素,测评目标,包含,将测评要素层层分解成测评目标、测评项目、测评指标
将测评要素,测评项目,包含,将测评要素层层分解成测评目标、测评项目、测评指标
岗位序列,具体的岗位,包含,每个岗位序列包含诸多具体的岗位
工作价值观,职业的伦理道德,包含,工作价值观包括从职业的伦理道德到工作的偏好
工作分析,所有管理需要的工作信息,包含,工作分析所搜集的信息应该包含所有管理需要的工作信息。
工作分析的信息内容,任职资格,包含,工作分析的信息内容包括工作描述、任职资格分析两大部分。
工作权限,人事权限,包含,工作权限一般包括三个部分：人事权限、财务权限和重大的业务权限
工作权限,财务权限,包含,工作权限一般包括三个部分：人事权限、财务权限和重大的业务权限
工作权限,重大的业务权限,包含,工作权限一般包括三个部分：人事权限、财务权限和重大的业务权限
工作环境,物质环境,包含,它重视如何设计适合于每一个人的工作程序与工作环境(包括物质环境的设备、工具、机器设计等)
工作环境的信息,工作时间表,包含,工作环境的信息包括工作的物理环境(如高温、嘈杂、严寒等)、工作时间表以及组织和社会的环境
工作环境的信息,工作的物理环境,包含,工作环境的信息包括工作的物理环境(如高温、嘈杂、严寒等)、工作时间表以及组织和社会的环境
工作的权限,决策的权限,包含,⑥工作的权限：包括决策的权限、对其他人实施监督的权限以及经费预算的权限等；
工作的权限,实施监督的权限,包含,⑥工作的权限：包括决策的权限、对其他人实施监督的权限以及经费预算的权限等；
工作的权限,经费预算的权限,包含,⑥工作的权限：包括决策的权限、对其他人实施监督的权限以及经费预算的权限等；
工作系统,工作组织,包含,工作系统包括工作者、工作组织和工作本身。
工作职位概要,工作任务,包含,工作职位概要一般包括：职位名称、工作任务和工作条件。
工作职位概要,工作条件,包含,工作职位概要一般包括：职位名称、工作任务和工作条件。
工作职位概要,职位名称,包含,工作职位概要一般包括：职位名称、工作任务和工作条件。
常用的评估工具,绩效考核,包含,常用的评估工具包括绩效考核的数据
常见的报酬因素,努力程度,包含,常见的报酬因素包括技能、责任、工作条件和努力程度等
常见的报酬因素,工作条件,包含,常见的报酬因素包括技能、责任、工作条件和努力程度等
常见的报酬因素,责任,包含,常见的报酬因素包括技能、责任、工作条件和努力程度等
常见的职位评价技术,因素比较法,包含,组织最常见的职位评价技术包括以下四种：强制排序法、职位分类法、点值要素法和因素比较法。
常见的职位评价技术,强制排序法,包含,组织最常见的职位评价技术包括以下四种：强制排序法、职位分类法、点值要素法和因素比较法。
常见的职位评价技术,点值要素法,包含,组织最常见的职位评价技术包括以下四种：强制排序法、职位分类法、点值要素法和因素比较法。
序列的专业胜任能力,产品知识技术能力,包含,该序列的专业胜任能力则包括市场信息分析能力、产品知识技术能力、客户关系管理能力、销售业务管理能力等
开发分层分类的人力资源管理系统,培训,包含,开发分层分类的人力资源管理系统(具体包括招聘、培训、工作设计、报酬和绩效评价等人力资源管理实践)
开发分层分类的人力资源管理系统,工作设计,包含,开发分层分类的人力资源管理系统(具体包括招聘、培训、工作设计、报酬和绩效评价等人力资源管理实践)
开发分层分类的人力资源管理系统,报酬,包含,开发分层分类的人力资源管理系统(具体包括招聘、培训、工作设计、报酬和绩效评价等人力资源管理实践)
开发分层分类的人力资源管理系统,招聘,包含,开发分层分类的人力资源管理系统(具体包括招聘、培训、工作设计、报酬和绩效评价等人力资源管理实践)
开发分层分类的人力资源管理系统,绩效评价等人力资源,包含,开发分层分类的人力资源管理系统(具体包括招聘、培训、工作设计、报酬和绩效评价等人力资源管理实践)
影响劳动需求的因素,经济增长,包含,影响劳动需求的因素主要包括经济增长、经济转型、资本有机构成和产业结构等。
思考能力,决策的能力,包含,在思考能力中包括资源管理能力和解决问题以及决策的能力。
思考能力,决策能力,包含,思考能力包括资源管理能力以及问题解决与决策能力。
思考能力,管理能力,包含,在思考能力中包括资源管理能力和解决问题以及决策的能力。
总报酬模型,个人发展,包含,总报酬模型包括薪酬、福利、平衡工作与生活、绩效与认可、个人发展与职业机会等五个部分。
总报酬模型,福利,包含,总报酬模型包括薪酬、福利、平衡工作与生活、绩效与认可、个人发展与职业机会等五个部分。
总报酬模型,薪酬,包含,总报酬模型包括薪酬、福利、平衡工作与生活、绩效与认可、个人发展与职业机会等五个部分。
总的劳动力,失业者,包含,总的劳动力包括在业者和失业者。
成功绩效的能力要素,行为方式,包含,决定成功绩效的能力要素既包括一个人所具有的专业知识和行为方式等表层的因素
战略,外部竞争策略,包含,战略是内部管理优化和外部竞争策略的组合。
战略学习,战略强化型学习,包含,战略学习包括战略强化型学习和战略更新型学习。
战略学习,战略更新型学习,包含,战略学习包括战略强化型学习和战略更新型学习。
所有人格因素的基础,人格维度,包含,有五项人格维度构成了所有人格因素的基础
所有培训,团队功能的感受,包含,且所有培训都包括对团队功能的感受、知觉、信念的检验与讨论
承担的责任,工作任务的分配,包含,他们承担的责任包括控制工作节奏、决定工作任务的分配、安排工作时间等。
技能培训,技能方面的培训,包含,技能培训包括组织、领导、管理及个人技能方面的培训。
技能清单,所有的员工,包含,其技能清单中要包括所有的员工；而对于那些组织人员流动频率不高
招聘,素质测评,包含,招聘按照报名、资格审查、考试考核（包括笔试、面试和素质测评）、决定聘用的程序进行。
招聘广告的内容,人事政策,包含,招聘广告的内容包括：广告题目、公司简介、审批机关、招聘岗位、人事政策、联系方式
招聘广告的内容,审批机关,包含,招聘广告的内容包括：广告题目、公司简介、审批机关、招聘岗位、人事政策、联系方式
招聘广告的内容,招聘岗位,包含,招聘广告的内容包括：广告题目、公司简介、审批机关、招聘岗位、人事政策、联系方式
招聘流程,招聘的准备阶段,包含,招聘流程包括招聘的准备阶段、实施阶段和评估阶段三个阶段；狭义上来看
招聘流程,评估阶段,包含,招聘流程包括招聘的准备阶段、实施阶段和评估阶段三个阶段；狭义上来看
招聘过程,招聘工作的评估,包含,而实际上对招聘工作的评估和反馈是招聘过程的一个重要的组成部分。
指标体系,绩效指标,包含,指标体系包括了绩效指标和与之相对应的标准。
提供的社会救助,实物援助,包含,国家或社会提供的社会救助包括现金援助、实物援助、服务援助等
提到的工作关系,职位在组织中的位置,包含,职位描述中所提到的工作关系主要包括两部分：一部分是该职位在组织中的位置
社会保险制度,基本养老保险,包含,社会保险制度包括基本养老保险、基本医疗保险、失业保险、工伤保险和生育保险五个项目
社会保险制度,基本医疗保险,包含,社会保险制度包括基本养老保险、基本医疗保险、失业保险、工伤保险和生育保险五个项目
社会保险制度,失业保险,包含,社会保险制度包括基本养老保险、基本医疗保险、失业保险、工伤保险和生育保险五个项目
社会保险制度,工伤保险,包含,社会保险制度包括基本养老保险、基本医疗保险、失业保险、工伤保险和生育保险五个项目
社会保险制度,生育保险,包含,社会保险制度包括基本养老保险、基本医疗保险、失业保险、工伤保险和生育保险五个项目
社会保障体系,基本社会保障,包含,社会保障体系可以划分为基本社会保障（正式制度安排）和补充社会保障（非正式制度）两个部分。
社会保障体系,基本社会保障制度,包含,社会保障体系通常包括基本社会保障制度与补充社会保障两大类
社会保障体系,工薪劳动者,包含,不仅工薪劳动者纳入了社会保障体系
社会保障体系,已有的社会救助项目,包含,社会保障体系不仅包括各种已有的社会救助项目与社会保险项目
社会保障制度的基石,面向贫困人口的社会救助,包含,面向贫困人口的社会救助构成了各国社会保障制度的基石等等。
社会保障法的基本内容,社会保障法的调整对象,包含,社会保障法的基本内容包括社会保障法的调整对象、主体与客体等。
社会保障,社会保险,包含,社会保障的内容主要包括社会救助、社会保险与社会福利三大部分
社会保障,社会救助,包含,社会保障的内容主要包括社会救助、社会保险与社会福利三大部分
社会制度,社会保障子系统,包含,作为一个由多个社会保障子系统或项目构成的基本社会制度
社会成员,劳动者,包含,由于社会成员包括劳动者在社会生活以及劳动过程中
社会现实,有意义的社会行为,包含,他的主要观点是：社会现实从根本上讲是由人们和他们有意义的社会行为构成的
社会福利,儿童福利,包含,各种儿童福利构成了社会福利的重要内容。
社会福利项目的资金来源,政府的财政预算拨款,包含,社会福利项目的资金来源包括各级政府的财政预算拨款
社会经济制度,职业的分工,包含,职业的分工是构成社会经济制度运行的主体
社会经济状况,经济要素,包含,社会经济状况包括经济要素的性质、水平、结构、变动趋势等多方面的内容
社保基金的投资方向,投资企业债券,包含,社保基金的投资方向包括四个方面：银行存款、国债买卖、投资企业债券和金融债券、进入证券市场。
社保基金的投资方向,证券市场,包含,社保基金的投资方向包括四个方面：银行存款、国债买卖、投资企业债券和金融债券、进入证券市场。
福利,道德伦理的说教,包含,福利往往包含着道德伦理的说教
科学合理的工作说明书,绩效指标,包含,科学合理的工作说明书必然包含绩效指标一项
简单的学习过程,组织的大量渐进型创新,包含,简单的学习过程包括组织的大量渐进型创新。
管理体系设计,奖金,包含,进而影响薪酬战略）；制度层面是薪酬管理体系设计的具体内容（包括薪酬结构、薪酬水平、奖金、福利等
管理体系设计,福利,包含,进而影响薪酬战略）；制度层面是薪酬管理体系设计的具体内容（包括薪酬结构、薪酬水平、奖金、福利等
管理体系设计,薪酬水平,包含,进而影响薪酬战略）；制度层面是薪酬管理体系设计的具体内容（包括薪酬结构、薪酬水平、奖金、福利等
管理体系设计,薪酬结构,包含,进而影响薪酬战略）；制度层面是薪酬管理体系设计的具体内容（包括薪酬结构、薪酬水平、奖金、福利等
管理流程,企业的人力资源管理流程,包含,管理流程包括企业的人力资源管理流程、财务管理流程等。
管理者的能力,学习的能力,包含,一个管理者的能力应该包括四个方面：一是学习的能力
系统的人力资源管理体系,工作分析,包含,和前文所述的工作分析、招聘甄选等共同构成系统的人力资源管理体系。
系统的人力资源管理体系,招聘甄选,包含,和前文所述的工作分析、招聘甄选等共同构成系统的人力资源管理体系。
素质维度,压力的反应能力,包含,素质维度包括对压力的反应能力、智力、身体协调性和服务意识等。
素质维度,服务意识,包含,素质维度包括对压力的反应能力、智力、身体协调性和服务意识等。
组合薪酬制,岗位技能薪酬制,包含,组合薪酬制的两种主要组合形式是岗位技能薪酬制和多元的组合薪酬制。
组织业绩,组织的经营成果,包含,组织业绩包括了一个组织的经营成果——成本（费用）与营收（收入）。
组织人力资源补偿规划,福利保障补偿规划,包含,组织人力资源补偿规划的内容主要包括现值补偿规划、福利保障补偿规划和期望补偿规划。
组织人力资源补偿规划,现值补偿规划,包含,组织人力资源补偿规划的内容主要包括现值补偿规划、福利保障补偿规划和期望补偿规划。
组织成员能力,专业能力,包含,组织成员能力包括两大类:第一类是专业能力
组织文化,物质要素,包含,组织文化包括物质要素、行为要素和精神要素
组织文化,精神要素,包含,组织文化包括物质要素、行为要素和精神要素
组织文化,行为要素,包含,组织文化包括物质要素、行为要素和精神要素
组织文化的冲突,集成业务文化模式,包含,分销型文化与集成业务文化模式构成了组织文化的冲突
组织文化的基本内容,价值观体系,包含,组织文化的基本内容包括组织的价值观体系、管理理念、职业伦理以及团队意识等要素。
组织文化的基本内容,团队意识,包含,组织文化的基本内容包括组织的价值观体系、管理理念、职业伦理以及团队意识等要素。
组织文化的基本内容,管理理念,包含,组织文化的基本内容包括组织的价值观体系、管理理念、职业伦理以及团队意识等要素。
组织文化的基本内容,职业伦理,包含,组织文化的基本内容包括组织的价值观体系、管理理念、职业伦理以及团队意识等要素。
组织的人工成本,人力资本收益,包含,人力资本收益实际上构成了组织的人工成本
组织的文化资本,具有物质性的组织理念,包含,组织的文化资本既包括具有物质性的组织理念、组织精神、组织气氛
组织的文化资本,组织气氛,包含,组织的文化资本既包括具有物质性的组织理念、组织精神、组织气氛
组织的文化资本,组织精神,包含,组织的文化资本既包括具有物质性的组织理念、组织精神、组织气氛
组织管理的范围,员工发展,包含,将员工发展纳入组织管理的范围
组织背景,人际关系,包含,组织背景包括人际关系、群体素质、领导因素、组织状况等。
经典的组织结构形式,事业部式,包含,5.经典的组织结构形式包括四种类型：职能式、事业部式（区域性、产品性和顾客性）、混合式、矩阵式。
结构体系的内容,职能结构,包含,这个结构体系的内容主要包括：·职能结构
给付期限,等待期,包含,失业保险金的给付期限包括等待期和最长给付期。
给付期限,最长给付期,包含,失业保险金的给付期限包括等待期和最长给付期。
绝对评估法,360度考核法,包含,绝对评估法主要包括自我报告法、业绩评定表法、因素考核法和360度考核法等。
绝对评估法,业绩评定表法,包含,绝对评估法主要包括自我报告法、业绩评定表法、因素考核法。
绝对评估法,因素考核法,包含,绝对评估法主要包括自我报告法、业绩评定表法、因素考核法。
绩效指标体系,绩效指标,包含,完整意义上的绩效指标体系不仅包括绩效指标
绩效管理,绩效考核,包含,绩效考核是绩效管理的一个不可或缺的组成部分。
绩效考核,组织考核,包含,绩效考核包括组织考核与员工考核
绩效考核,员工考核,包含,绩效考核包括组织考核与员工考核
绩效计划,工作计划,包含,绩效计划主要包括工作计划和绩效指标两种形式。
绩效计划,绩效指标,包含,绩效计划主要包括工作计划和绩效指标两种形式。
绩效评价的范畴,个人潜力,包含,将个人潜力和能力也纳入绩效评价的范畴；此时
绩效评价的范畴,能力,包含,将个人潜力和能力也纳入绩效评价的范畴；此时
绩效面谈,改进措施,包含,绩效面谈的内容主要包括工作业绩、行为表现、改进措施和新的目标等四个主要方面。
美国戴尔公司的培训内容,技术技能,包含,美国戴尔公司的培训内容则包括企业文化定位、技术技能、领导艺术及挖掘员工潜能方面的课程。
美国戴尔公司的培训内容,领导艺术,包含,美国戴尔公司的培训内容则包括企业文化定位、技术技能、领导艺术及挖掘员工潜能方面的课程。
美国的劳动力范畴,劳动力,包含,美国的劳动力范畴包含以下几个基本概念：劳动力、非劳动力、就业者和失业者。
美国的劳动力范畴,失业者,包含,美国的劳动力范畴包含以下几个基本概念：劳动力、非劳动力、就业者和失业者。
美国的劳动力范畴,非劳动力,包含,美国的劳动力范畴包含以下几个基本概念：劳动力、非劳动力、就业者和失业者。
美国职业生涯联盟,美国职业生涯信息网,包含,如美国职业生涯联盟（包括美国工作银行、美国学习交换协会、美国职业生涯信息网以及美国服务网）。
老年人福利的必要内容,直接的现金津贴,包含,按照普遍性原则为老年人提供直接的现金津贴就构成了老年人福利的必要内容。
细类,工种名称,包含,每一细类（职业）的内容包括职业编码、职业名称、职业定义、职业描述及归入本职业的工种名称与编码等。
细类,职业名称,包含,每一细类（职业）的内容包括职业编码、职业名称、职业定义、职业描述及归入本职业的工种名称与编码等。
细类,职业定义,包含,每一细类（职业）的内容包括职业编码、职业名称、职业定义、职业描述及归入本职业的工种名称与编码等。
细类,职业描述,包含,每一细类（职业）的内容包括职业编码、职业名称、职业定义、职业描述及归入本职业的工种名称与编码等。
细类,职业编码,包含,每一细类（职业）的内容包括职业编码、职业名称、职业定义、职业描述及归入本职业的工种名称与编码等。
职业动机,职业洞察力,包含,职业动机包括职业适应性、职业洞察力与职业认同感三个方面。
职业动机,职业适应性,包含,职业动机包括职业适应性、职业洞察力与职业认同感三个方面。
职业发展理论,职业生涯,包含,这一时期的职业发展理论不只是包含职业生涯
职业安全,职业生涯设计,包含,这种“职业安全”不仅包括职业生涯设计
职业开发,个人角度的职业规划,包含,职业开发包含两个过程：个人角度的职业规划和组织角度的职业管理。
职业开发,组织角度的职业管理,包含,职业开发包含两个过程：个人角度的职业规划和组织角度的职业管理。
职业开发,职业管理,包含,职业开发包含两个过程：职业规划和职业管理。
职业开发,职业规划,包含,职业开发包含两个过程：职业规划和职业管理。
职业特定要求,特定的职业知识,包含,职业特定要求还包括特定的职业知识、技能以及机器、工具和设备
职业生涯,工作相关的个人活动,包含,与工作相关的个人活动及其对这些活动所做出的主观反应都是其职业生涯的组成部分
职业生涯的定义,易变性职业生涯,包含,现时期关于职业生涯的定义包括易变性职业生涯与多元职业生涯。
职业生涯管理,员工的自我管理,包含,职业生涯管理一般包括两个方面：第一是员工的自我管理
职业生涯计划,生涯目标,包含,职业生涯计划一般包括职业、生涯目标和职业生涯通道三个方面的内容
职业生涯计划,职业,包含,职业生涯计划一般包括职业、生涯目标和职业生涯通道三个方面的内容
职业生涯计划,职业生涯通道,包含,职业生涯计划一般包括职业、生涯目标和职业生涯通道三个方面的内容
职业的敏感性,职业弹性,包含,职业的敏感性包括职业弹性、职业洞察力和职业认同感等几个方面。
职业的敏感性,职业洞察力,包含,职业的敏感性包括职业弹性、职业洞察力和职业认同感等几个方面。
职业的敏感性,职业认同感,包含,职业的敏感性包括职业弹性、职业洞察力和职业认同感等几个方面。
职业管理,职业规划,包含,职业管理往往又包括职业规划
职位,战略性任务,包含,职位有三大特征：一是每一个职位都是战略性任务和运作性任务的组合；二是职位在组织中层级越高
职位,运作性任务,包含,职位有三大特征：一是每一个职位都是战略性任务和运作性任务的组合；二是职位在组织中层级越高
职位分析,职位描述,包含,职位分析的最终结果包括两个部分：职位描述和职位规范(任职资格)。
职位分析,职位规范,包含,职位分析的最终结果包括两个部分：职位描述和职位规范(任职资格)。
职位升降,员工行为能力的考核,包含,因此对员工工作绩效的考核以及对员工行为能力的考核就构成了职位升降的客观依据
职位升降,工作绩效的考核,包含,因此对员工工作绩效的考核以及对员工行为能力的考核就构成了职位升降的客观依据
职位等级,职位的价值差异,包含,带宽主要取决于以下几个方面的因素：·职位等级所包含职位的价值差异性：价值差异性越大
职位等级说明,工作的任务,包含,职位等级说明中应包括工作的任务、类型和特点
职位评价,学历,包含,则职位评价中必须包含学历与相关工作经验两项内容。
职务的信息描述,工作条件,包含,对职务的信息描述通常包括工作条件、工具与仪器
背景材料,企业组织图,包含,这些背景材料包括企业组织图、岗位配置图、工作流程图以及原有的工作说明书等。
背景材料,原有的工作说明书,包含,这些背景材料包括企业组织图、岗位配置图、工作流程图以及原有的工作说明书等。
背景材料,工作流程图,包含,这些背景材料包括企业组织图、岗位配置图、工作流程图以及原有的工作说明书等。
背景调查,学历,包含,背景调查通常包括犯罪记录、信用状况、工作经历、学历和从业许可等。
胜任力,价值观,包含,许多学者认为胜任力包括了知识、态度、技能和价值观。
胜任力,抽象的能力,包含,（1）胜任力：包含各种明确的或较为抽象的能力；
胜任力模型,胜任力标准,包含,胜任力标准即可构成一组胜任力模型；为帮助管理者开发他们的员工
能力,无关的原始能力,包含,能力是由许多彼此无关的原始能力所构成的。
英国失业保险制度类型,强制性失业保险,包含,英国失业保险制度类型是由强制性失业保险和失业救助共同构成的双层次保障制度[9]。
营销部经理的考核,团队建设,包含,对营销部经理的考核中包括了团队建设和客户服务质量考核指标。
营销部经理的考核,客户服务质量考核,包含,对营销部经理的考核中包括了团队建设和客户服务质量考核指标。
薪酬,内在薪酬,包含,并将薪酬划分为外在薪酬和内在薪酬
薪酬,基本工资,包含,其薪酬是基本工资和基于绩效的可变薪酬的组合。
薪酬,外在报酬,包含,所以薪酬应当包括外在报酬与内在报酬两个方面。
薪酬,外在薪酬,包含,并将薪酬划分为外在薪酬和内在薪酬
薪酬,奖励性报酬,包含,确定应付给每个职务岗位占有者的薪酬（包括基薪、奖励性报酬和福利津贴）；·根据定期的工作业绩考评
