Janus绩效管理系统,参考库,包含,并且把它们作为一个参考库纳入Janus绩效管理系统之中。
NET数据搜集项目,评定量表,包含,向这些员工发放四份标准化问卷搜集数据；O*NET数据搜集项目中包含数百个评定量表
上规模的招聘,不同学历,包含,上规模的招聘一般在10～35人之间（包括不同学历、工作经验等）。
上述四大能力维度,具体的能力要素,包含,在上述四大能力维度下包括以下具体的能力要素。
不同的人力资源管理战略,薪酬战略,包含,Gerge T.Milkovich认为不同的人力资源管理战略（包括薪酬战略）要适应不同的企业战略
不定时工时制,弹性工作的员工,包含,北京和长沙的不定时工时制似乎包括了弹性工作的员工。
专业序列的通用能力,分析能力,包含,这个专业序列的通用能力包括沟通表达能力、逻辑分析能力、协调推进能力
专业序列的通用能力,推进能力,包含,这个专业序列的通用能力包括沟通表达能力、逻辑分析能力、协调推进能力
专业序列的通用能力,沟通表达能力,包含,这个专业序列的通用能力包括沟通表达能力、逻辑分析能力、协调推进能力
业务战略,产品领域内的竞争方式,包含,（2）业务战略（Business Strategy）：包括产业选择及在产品领域内的竞争方式选择
个人收入,劳动报酬,包含,个人收入不仅包括劳动报酬
个人收入,劳动收入,包含,由于个人收入包括劳动收入和非劳动收入
个人收入,非劳动收入,包含,由于个人收入包括劳动收入和非劳动收入
个人的职业生涯,确定的职业,包含,必须获得一个确定的职业或是达到某种社会地位才能构成一个人的职业生涯。
个人的职业生涯,社会地位,包含,必须获得一个确定的职业或是达到某种社会地位才能构成一个人的职业生涯。
中国的退休养老制度,一般退休制度,包含,并与一般退休制度一起构成了中国的退休养老制度。
中国管理,人力资源管理,包含,加速中国管理包括人力资源管理与国际接轨的进程
主持人的职责,整个TTA分析过程,包含,主持人的职责包括主持整个TTA分析过程
主要的竞争策略,差异化策略,包含,主要的竞争策略包括总成本领先策略、差异化策略和集中化经营策略。
主要的竞争策略,集中化经营策略,包含,主要的竞争策略包括总成本领先策略、差异化策略和集中化经营策略。
主要责任主体,公司的高层管理者,包含,参与人力资源管理的主要责任主体包括：公司的高层管理者、直线管理人员、人力资源部和公司的每一位员工
主要责任主体,员工,包含,参与人力资源管理的主要责任主体包括：公司的高层管理者、直线管理人员、人力资源部和公司的每一位员工
人力资本倾向,人力资源制度反馈性,包含,[5]人力资源制度反馈性审计有时会部分地纳入人力资本倾向审计之中；[6]流程的定义是非常多的
人力资本倾向,总体的员工满意度审计,包含,但人力资本倾向审计不仅包括总体的员工满意度审计
人力资本投资,直接成本,包含,由直接成本以及机会成本构成的人力资本投资。
人力资本结构,成就动机等素质结构,包含,但人力资本结构还包括职位、部门等工作特征结构与影响力、成就动机等素质结构。
人力资本结构,职位,包含,但人力资本结构还包括职位、部门等工作特征结构与影响力、成就动机等素质结构。
人力资本结构,部门等工作特征结构,包含,但人力资本结构还包括职位、部门等工作特征结构与影响力、成就动机等素质结构。
人力资源内部规则,人力资源制度,包含,人力资源内部规则可以被定义为包括两个方面：人力资源制度和人力资源流程。
人力资源内部规则,人力资源流程,包含,人力资源内部规则可以被定义为包括两个方面：人力资源制度和人力资源流程。
人力资源审计,人力资源法律审计,包含,人力资源法律审计只是人力资源审计的组成部分之一
人力资源审计,公司治理,包含,人力资源治理要像公司治理一样纳入人力资源审计的范畴之内。
人力资源开发,培训,包含,人力资源开发包括培训与开发、职业开发与组织发展。
人力资源开发,培训以外的活动,包含,人力资源开发包括许多培训以外的活动
人力资源开发,职业开发,包含,人力资源开发包括培训与开发、职业开发与组织发展。
人力资源战略规划,人力资源数量规划,包含,人力资源战略规划包括三个方面：人力资源数量规划、人力资源结构规划、人力资源素质规划。
人力资源战略规划,人力资源素质规划,包含,人力资源战略规划包括三个方面：人力资源数量规划、人力资源结构规划、人力资源素质规划。
人力资源战略规划,人力资源结构规划,包含,人力资源战略规划包括三个方面：人力资源数量规划、人力资源结构规划、人力资源素质规划。
人力资源战略规划的一般内容,企业发展战略,包含,人力资源战略规划的一般内容包括以下几个方面：(1)理解企业发展战略及策略目标体系
人力资源管理,人员的招聘,包含,人力资源管理包括各种涉及所有类型人员的招聘、雇佣、培训、开发和报酬等各种活动。
人力资源管理,培训,包含,人力资源管理包括各种涉及所有类型人员的招聘、雇佣、培训、开发和报酬等各种活动。
人力资源管理,工作任务,包含,人力资源管理主要包括选人、用人、育人、激励人、留人等内容和工作任务。
人力资源管理,报酬,包含,人力资源管理包括各种涉及所有类型人员的招聘、雇佣、培训、开发和报酬等各种活动。
人力资源管理,组织设计的成分,包含,人力资源管理内容中也就必然的包含了组织设计的成分
人力资源管理体系,培训,包含,人力资源管理体系主要包括招聘、培训、薪酬、绩效等多个模块。
人力资源管理体系,招聘,包含,人力资源管理体系主要包括招聘、培训、薪酬、绩效等多个模块。
人力资源管理体系,薪酬,包含,人力资源管理体系主要包括招聘、培训、薪酬、绩效等多个模块。
人力资源管理实践,报酬,包含,这些人力资源管理实践所包括的领域有：人员配备、开发、报酬、组织设计以及沟通等。
人力资源管理实践,组织设计,包含,这些人力资源管理实践所包括的领域有：人员配备、开发、报酬、组织设计以及沟通等。
人力资源管理框架,组织建设,包含,将组织建设纳入人力资源管理框架中
人力资源管理系统,绩效考核,包含,（2）绩效考核是人力资源管理系统的组成部分
人员系统,动机,包含,人员系统应该包括很多方面:认知能力、动机、职业价值观与兴趣等。
人员系统,职业价值观,包含,人员系统应该包括很多方面:认知能力、动机、职业价值观与兴趣等。
人员系统,认知能力,包含,人员系统应该包括很多方面:认知能力、动机、职业价值观与兴趣等。
人格系统,动机,包含,人格系统包括动机和角色扮演技巧
人的外显行为,非语言行为,包含,人的外显行为包括语言行为与非语言行为
人的认知能力,推理能力,包含,人的认知能力包括三个维度：语言理解能力、数量能力和推理能力。
人的认知能力,数量能力,包含,人的认知能力包括三个维度：语言理解能力、数量能力和推理能力。
人的认知能力,理解能力,包含,人的认知能力包括三个维度：语言理解能力、数量能力和推理能力。
价值观,内容属性,包含,价值观包括内容属性和强度属性。
价值观,强度属性,包含,价值观包括内容属性和强度属性。
任务,完成任务的具体步骤,包含,专家将这四项任务分解成完成任务的具体步骤。
任务描述,任务主体,包含,任务描述应包括以下内容：(1)任务主体
任职资格,重要的报酬要素,包含,任职资格包含着大量重要的报酬要素
企业人力资源管理,培训,包含,企业人力资源管理实践包括招聘、培训、工作设计、考核、薪酬等一系列活动
企业人力资源管理,工作设计,包含,企业人力资源管理实践包括招聘、培训、工作设计、考核、薪酬等一系列活动
企业人力资源管理,招聘,包含,企业人力资源管理实践包括招聘、培训、工作设计、考核、薪酬等一系列活动
企业人力资源管理,薪酬等一系列活动,包含,企业人力资源管理实践包括招聘、培训、工作设计、考核、薪酬等一系列活动
企业培训,培训效果,包含,企业培训开发活动通常包括培训需求分析、培训计划制定、培训活动组织实施以及培训效果评估四个环节。
企业培训,培训活动组织,包含,企业培训开发活动通常包括培训需求分析、培训计划制定、培训活动组织实施以及培训效果评估四个环节。
企业培训,培训计划,包含,企业培训开发活动通常包括培训需求分析、培训计划制定、培训活动组织实施以及培训效果评估四个环节。
企业培训,培训需求分析,包含,企业培训开发活动通常包括培训需求分析、培训计划制定、培训活动组织实施以及培训效果评估四个环节。
企业年金,退休保险,包含,企业年金包括各种类型的企业补充退休保险
企业文化,企业价值观念,包含,企业文化包括企业规章制度、企业思想作风、企业价值观念、企业行为方式等多方面
企业文化,企业行为方式等多方面,包含,企业文化包括企业规章制度、企业思想作风、企业价值观念、企业行为方式等多方面
企业的平衡计分卡,投资回报率,包含,一个企业的平衡计分卡可以包括以下指标：利润、营业额、销售额、现金流、投资回报率
企业的核心竞争力,人力资本,包含,即人力资本、社会资本和组织资本等以知识为基础的资本架构组成了企业的核心竞争力
企业的核心竞争力,社会资本,包含,即人力资本、社会资本和组织资本等以知识为基础的资本架构组成了企业的核心竞争力
企业的核心竞争力,资本架构,包含,即人力资本、社会资本和组织资本等以知识为基础的资本架构组成了企业的核心竞争力
企业的社会责任,经济责任,包含,该理论认为企业的社会责任不仅包括经济责任
企业的组织模式,业务运作模式,包含,一个企业的组织模式主要包括企业的组织结构、业务运作流程、业务运作模式
企业的组织模式,业务运作流程,包含,一个企业的组织模式主要包括企业的组织结构、业务运作流程、业务运作模式
企业的组织模式,企业的组织结构,包含,一个企业的组织模式主要包括企业的组织结构、业务运作流程、业务运作模式
企业的绩效考核指标,企业层面,包含,企业的绩效考核指标也包含三个层面：企业层面、部门层面和职位层面。
企业的绩效考核指标,职位层面,包含,企业的绩效考核指标也包含三个层面：企业层面、部门层面和职位层面。
企业社会责任的研究,企业社会责任概念,包含,企业社会责任的研究主要包括两部分[20]:一部分专注于企业社会责任概念的界定和完善
企业经营,人力资源管理,包含,对于把人力资源管理与开发纳入到企业经营总战略和总决策之中是非常有利的。
企业绩效,测评指标,包含,把程序测评指标纳入企业绩效测评体系
企业责任,法律责任,包含,企业责任包括经济责任、法律责任、道德责任和自愿决定（慈善)责任
企业责任,经济责任,包含,企业责任包括经济责任、法律责任、道德责任和自愿决定（慈善)责任
企业责任,道德责任,包含,企业责任包括经济责任、法律责任、道德责任和自愿决定（慈善)责任
传统军人保障制度,中央政府的责任,包含,即传统军人保障制度的财政基础不仅包括了中央政府的责任
传统的职业生涯方式,专家型的职业生涯方式,包含,当然传统的职业生涯方式还包括专家型的职业生涯方式
传记式项目检核记录表,价值观,包含,传记式项目检核记录表一般包括工作情况、嗜好、健康、社会关系、态度、兴趣、价值观、自我印象等项目。
供应能力,积蓄资源的能力,包含,企业资源供应能力包括从外部获取资源的能力和从内部积蓄资源的能力。
供应能力,获取资源的能力,包含,企业资源供应能力包括从外部获取资源的能力和从内部积蓄资源的能力。
信息来源,人力资源储备,包含,这些信息来源包括：组织目标信息、人力资源储备信息、技能储备信息、组织氛围指数等。
信息来源,技能储备信息,包含,这些信息来源包括：组织目标信息、人力资源储备信息、技能储备信息、组织氛围指数等。
信息来源,组织氛围指数,包含,这些信息来源包括：组织目标信息、人力资源储备信息、技能储备信息、组织氛围指数等。
信息来源,组织目标,包含,这些信息来源包括：组织目标信息、人力资源储备信息、技能储备信息、组织氛围指数等。
公司原先的福利计划,带薪休假,包含,某家公司原先的福利计划包括房租津贴、交通补助费、意外险、带薪休假等。
关系管理,劳动关系管理,包含,员工关系管理主要有如下内容：(1)劳动关系管理
具体的人力资源管理,薪酬管理,包含,4.确定具体的人力资源管理（包括薪酬管理的）技术和方法
具体的职位特征,因素比较法,包含,而不考虑具体的职位特征；定量方法包括要素计点法和因素比较法
具体的职位特征,要素计点法,包含,而不考虑具体的职位特征；定量方法包括要素计点法和因素比较法
典型的战略地图,平衡计分卡,包含,典型的战略地图包含20～30个相互关联的平衡计分卡指标
典型的职能范围,企业文化,包含,其典型的职能范围包括劳动关系管理、员工沟通、员工活动、激励、企业文化和员工关怀等。
典型的职能范围,劳动关系管理,包含,其典型的职能范围包括劳动关系管理、员工沟通、员工活动、激励、企业文化和员工关怀等。
典型的职能范围,员工,包含,其典型的职能范围包括劳动关系管理、员工沟通、员工活动、激励、企业文化和员工关怀等。
典型的职能范围,员工关怀,包含,其典型的职能范围包括劳动关系管理、员工沟通、员工活动、激励、企业文化和员工关怀等。
典型的职能范围,员工活动,包含,其典型的职能范围包括劳动关系管理、员工沟通、员工活动、激励、企业文化和员工关怀等。
军人伤亡保险,军人伤残保险,包含,军人伤亡保险实际上包括军人死亡保险与军人伤残保险两项内容。
军人的福利事业,精神病收养事业,包含,面向军人的福利事业包括军人休养事业、疗养事业、精神病收养事业、孤老收养事业等内容。
决策类,企业家,包含,信息类包括发言人、联系人和监控者；决策类包括领导者、企业家、分配者。
决策类,分配者,包含,信息类包括发言人、联系人和监控者；决策类包括领导者、企业家、分配者。
分析对象,人力资源部门,包含,分析对象包括组织高层管理者、人力资源部门、各级管理人员、其他人员等。
创新小组的成员,营销人员,包含,一个创新小组的成员至少要包括技术人员、生产制造人员、营销人员、业务人员或财务人员
劳动力市场理事会,工会联盟,包含,由工会联盟和雇主联合会的代表组成“劳动力市场理事会”
劳动力流动,职业流动,包含,劳动力流动主要包括职业流动、行业流动和地域流动三种形式
劳动合同,劳动关系,包含,可以像劳动合同一样包含劳动关系的各个方面
劳动合同的其他事项,法规规定,包含,(9)法律、法规规定应当纳入劳动合同的其他事项；
劳动标准,劳动条件,包含,劳动标准具体包括工作时间、最低工资、劳动条件、女职工和未成年工保护等各项国家劳动标准。
劳动标准,国家劳动标准,包含,劳动标准具体包括工作时间、最低工资、劳动条件、女职工和未成年工保护等各项国家劳动标准。
劳动标准,工作时间,包含,劳动标准具体包括工作时间、最低工资、劳动条件、女职工和未成年工保护等各项国家劳动标准。
医疗保险体系,农业劳动者,包含,农村居民、农业劳动者一般是最后纳入医疗保险体系。
参与人力资源开发的人员,员工,包含,组织中参与人力资源开发的人员主要包括：最高领导层、人力资源部、其他职能部门和员工。
参与人员,人力资源部门,包含,这些参与人员要包括业务部门和人力资源部门的职员。
双环学习,组织规范下的探索,包含,双环学习不仅包括在已有组织规范下的探索
发展阶梯,职业生涯阶梯模式,包含,职业生涯发展阶梯包括：职业生涯阶梯模式
变量,生产效率,包含,在这一层次上的典型指标或变量包括：销售额、生产效率、增长率、利润率、职工满意度、用户满意度。
变量,社会阶级,包含,这类变量包括社会阶级、保守态度、疏离感、学历等
员工为中心的结果,动机,包含,①人力资源管理实践——以员工为中心的结果；以员工为中心的结果包括员工的能力、动机和态度
员工为中心的结果,员工的能力,包含,①人力资源管理实践——以员工为中心的结果；以员工为中心的结果包括员工的能力、动机和态度
员工的保密性,单位秘密,包含,员工的保密性为主要包括遵守保密制度、不泄漏单位秘密以及不利用单位秘密牟利。
员工薪酬,福利,包含,刘昕在其所著的《薪酬管理》一书中认为福利是员工薪酬中的重要组成部分
员工配置,人力资源,包含,员工配置包括人力资源的流入和流出等环节
员工配置,招聘,包含,在本书第一章我们阐述了员工配置的核心活动包括招聘、选拔和雇佣
周边绩效,意志动机等因素,包含,又存在任务绩效和周边绩效之分；任务绩效是指工作的直接结果；周边绩效则包括人际、意志动机等因素
品德行为测评法则,测评标准,包含,就是通过品德行为测评法则（包括测评标准与方法）
国家的养老保险,劳动者,包含,如瑞典就是普遍保障模式；有些国家的养老保险只包括劳动者
国家财政,社会保险费,包含,在将社会保险费（税）及待遇支付直接纳入国家财政范畴的条件下
国际人力资源管理,企业经营,包含,国际人力资源管理是处在人力资源活动、员工类型和企业经营所在国类型这三个维度之中的互动组合。
国际人力资源管理,员工类型,包含,国际人力资源管理是处在人力资源活动、员工类型和企业经营所在国类型这三个维度之中的互动组合。
培训,岗位培训,包含,2.部门层次的培训：包括业务技术能力培训和岗位培训两部分
培训,技术能力,包含,2.部门层次的培训：包括业务技术能力培训和岗位培训两部分
培训,组织发展,包含,人力资源开发职能已经从培训与开发转向了包括职业开发和组织发展在内的职能的转变；下面
培训,职业开发,包含,人力资源开发职能已经从培训与开发转向了包括职业开发和组织发展在内的职能的转变；下面
培训与开发活动,员工的业务培训,包含,当今许多组织的培训与开发活动主要包括三种：新员工的入职培训、管理技能开发以及对员工的业务培训。
培训与开发活动,新员工的入职培训,包含,当今许多组织的培训与开发活动主要包括三种：新员工的入职培训、管理技能开发以及对员工的业务培训。
培训专题,公共服务中的领导艺术,包含,培训专题主要包括：工作团队开发、公共服务中的领导艺术、高级行政人员相关能力
培训专题,工作团队,包含,培训专题主要包括：工作团队开发、公共服务中的领导艺术、高级行政人员相关能力
培训专题,高级行政人员相关能力,包含,培训专题主要包括：工作团队开发、公共服务中的领导艺术、高级行政人员相关能力
培训内容,基本的工作规范,包含,培训内容包括IBM的历史背景、规章制度、技术和产品以及基本的工作规范和工作技巧。
培训内容,市场销售,包含,三天的培训内容包括签订合同、制订经营计划、购买材料、组织生产、市场销售和财务等等。
培训内容,经营计划,包含,三天的培训内容包括签订合同、制订经营计划、购买材料、组织生产、市场销售和财务等等。
培训的内容,工作时间,包含,培训的内容应包括公司的保障制度、政策、安全法规、工作时间、薪酬和考核制度等激励机制和压力机制
培训的内容,技能培训,包含,培训的内容包括方法、技能培训
培训的前期工作,培训环境,包含,培训的前期工作包括准备可行的课程计划、装备视听或电脑设备、布置培训环境。
培训的成本,培训部门的管理费,包含,培训的成本包括培训人员和受训员的薪酬、培训部门的管理费和一般管理费等。
培训的成本,直接成本,包含,培训的成本主要包括直接成本和机会成本。
培训的效益,培训的社会效益,包含,培训的效益包括培训工作给企业带来的经济效益和培训的社会效益。
培训课程,人力成本管理,包含,培训课程包括品质管理、产品品质评估、服务沟通、有效管理时间、领导风格、人力成本管理和团队精神等。
培训课程,品质管理,包含,培训课程包括品质管理、产品品质评估、服务沟通、有效管理时间、领导风格、人力成本管理和团队精神等。
培训课程,领导风格,包含,培训课程包括品质管理、产品品质评估、服务沟通、有效管理时间、领导风格、人力成本管理和团队精神等。
基于人的薪酬制度,年功序列制,包含,基于人的薪酬制度包括年功序列制、技术等级工资制等。
基于人的薪酬制度,技术等级工资制,包含,基于人的薪酬制度包括年功序列制、技术等级工资制等。
基本养老保险范围,城镇个体工商户,包含,将自由职业人员、城镇个体工商户纳入基本养老保险范围。
基本养老保险范围,自由职业人员,包含,将自由职业人员、城镇个体工商户纳入基本养老保险范围。
基本医疗保险支付范围,基本医疗服务项目,包含,其中基本医疗服务项目可以纳入基本医疗保险支付范围。
基本工资范畴,绩效工资,包含,但将绩效工资纳入基本工资范畴
基本技能培训,沟通能力,包含,基本技能培训内容包括沟通能力、创造性和解决问题的能力以及基本知识等几方面。
基本技能培训,解决问题的能力,包含,基本技能培训内容包括沟通能力、创造性和解决问题的能力以及基本知识等几方面。
基本职业素质内容,沟通技巧,包含,基本职业素质内容包括沟通技巧、计算机操作能力、英文水平及发展潜力等。
基本职业素质内容,计算机操作能力,包含,基本职业素质内容包括沟通技巧、计算机操作能力、英文水平及发展潜力等。
基本薪酬,年资薪酬,包含,并存型职务薪酬制是一种把基本薪酬分解成职务薪酬和年资薪酬的薪酬制度。
基本薪酬,职务薪酬,包含,并存型职务薪酬制是一种把基本薪酬分解成职务薪酬和年资薪酬的薪酬制度。
基础技能,写作等文字能力,包含,基础技能主要包括阅读、写作等文字能力和认知能力。
基础技能,认知能力,包含,基础技能主要包括阅读、写作等文字能力和认知能力。
外在薪酬,货币奖励,包含,外在薪酬则包括货币奖励和非货币奖励；这种对薪酬的定义
外在薪酬,非货币奖励,包含,外在薪酬则包括货币奖励和非货币奖励；这种对薪酬的定义
外部招聘,校园招聘,包含,外部招聘包括社会招聘和校园招聘。
外部招聘,社会招聘,包含,外部招聘包括社会招聘和校园招聘。
多元工作设计问卷,知觉运动型,包含,多元工作设计问卷包括四个类型的内容：动机型、机械型、生理型、知觉运动型
奖励,奖金,包含,并对参与的员工进行奖励(包括表彰、晋升以及奖金)。
奖励计划,短期激励计划,包含,奖励计划也包括了长期激励计划和短期激励计划。
奖励计划,长期激励计划,包含,奖励计划也包括了长期激励计划和短期激励计划。
完整的养老保险制度,基本养老保险,包含,完整的养老保险制度不仅包括了旨在保障个人基本生活的基本养老保险层次
完整的绩效指标,构成要素,包含,一个完整的绩效指标与其标准一般包括四个构成要素
